{
  "version": "2.0",
  "keyboard": {
    "keys": {
      "A": "0x1e",
      "B": "0x30",
      "C": "0x2e",
      "D": "0x20",
      "E": "0x12",
      "F": "0x21",
      "G": "0x22",
      "H": "0x23",
      "I": "0x17",
      "J": "0x24",
      "K": "0x25",
      "L": "0x26",
      "M": "0x32",
      "N": "0x31",
      "O": "0x18",
      "P": "0x19",
      "Q": "0x10",
      "R": "0x13",
      "S": "0x1f",
      "T": "0x14",
      "U": "0x16",
      "V": "0x2f",
      "W": "0x11",
      "X": "0x2d",
      "Y": "0x15",
      "Z": "0x2c",
      "0": "0x0b",
      "1": "0x02",
      "2": "0x03",
      "3": "0x04",
      "4": "0x05",
      "5": "0x06",
      "6": "0x07",
      "7": "0x08",
      "8": "0x09",
      "9": "0x0a",
      "Escape": "0x01",
      "Tab": "0x0f",
      "CapsLock": "0x3a",
      "Enter": "0x1c",
      "LeftShift": "0x2a",
      "RightShift": "0x36",
      "LeftCtrl": "0x1d",
      "RightCtrl": "0x9d",
      "LeftAlt": "0x38",
      "RightAlt": "0xb8",
      "Space": "0x39",
      "Backspace": "0x0e",
      "Left": "0xcb",
      "Right": "0xcd",
      "Up": "0xc8",
      "Down": "0xd0",
      "Home": "0xc7",
      "End": "0xcf",
      "PageUp": "0xc9",
      "PageDown": "0xd1",
      "Delete": "0xd3",
      "Insert": "0xd2"
    }
  },
  "virtualModifiers": {
    "M00": {
      "trigger": "CapsLock",
      "tapAction": "Escape"
    }
  },
  "mappings": [
    {
      "from": "M00-H",
      "to": "Left"
    },
    {
      "from": "M00-J",
      "to": "Down"
    },
    {
      "from": "M00-K",
      "to": "Up"
    },
    {
      "from": "M00-L",
      "to": "Right"
    },
    {
      "from": "M00-W",
      "to": "Ctrl-Right"
    },
    {
      "from": "M00-B",
      "to": "Ctrl-Left"
    },
    {
      "from": "M00-E",
      "to": "Ctrl-Right"
    },
    {
      "from": "M00-0",
      "to": "Home"
    },
    {
      "from": "M00-4",
      "to": "End"
    },
    {
      "from": "M00-G",
      "to": ["Ctrl-Home"]
    },
    {
      "from": "M00-Shift-G",
      "to": ["Ctrl-End"]
    },
    {
      "from": "M00-D",
      "to": "Delete"
    },
    {
      "from": "M00-X",
      "to": ["Shift-Delete"]
    },
    {
      "from": "M00-P",
      "to": ["Shift-Insert"]
    },
    {
      "from": "M00-Y",
      "to": ["Shift-End", "Ctrl-C"]
    },
    {
      "from": "M00-U",
      "to": "Ctrl-Z"
    },
    {
      "from": "M00-Ctrl-R",
      "to": "Ctrl-Y"
    },
    {
      "from": "M00-I",
      "to": ["Home", "Insert"]
    },
    {
      "from": "M00-A",
      "to": ["End", "Insert"]
    },
    {
      "from": "M00-O",
      "to": ["End", "Enter", "Insert"]
    }
  ]
}
