{
  "version": "2.0",
  "keyboard": {
    "keys": {
      "A": "0x1e",
      "B": "0x30",
      "C": "0x2e",
      "D": "0x20",
      "E": "0x12",
      "F": "0x21",
      "G": "0x22",
      "H": "0x23",
      "I": "0x17",
      "J": "0x24",
      "K": "0x25",
      "L": "0x26",
      "M": "0x32",
      "N": "0x31",
      "O": "0x18",
      "P": "0x19",
      "Q": "0x10",
      "R": "0x13",
      "S": "0x1f",
      "T": "0x14",
      "U": "0x16",
      "V": "0x2f",
      "W": "0x11",
      "X": "0x2d",
      "Y": "0x15",
      "Z": "0x2c",
      "0": "0x0b",
      "1": "0x02",
      "2": "0x03",
      "3": "0x04",
      "4": "0x05",
      "5": "0x06",
      "6": "0x07",
      "7": "0x08",
      "8": "0x09",
      "9": "0x0a",
      "Escape": "0x01",
      "Tab": "0x0f",
      "CapsLock": "0x3a",
      "Enter": "0x1c",
      "LeftShift": "0x2a",
      "RightShift": "0x36",
      "LeftCtrl": "0x1d",
      "RightCtrl": "0x9d",
      "LeftAlt": "0x38",
      "RightAlt": "0xb8",
      "LeftWin": "0xdb",
      "RightWin": "0xdc",
      "Space": "0x39",
      "Backspace": "0x0e",
      "Left": "0xcb",
      "Right": "0xcd",
      "Up": "0xc8",
      "Down": "0xd0",
      "Home": "0xc7",
      "End": "0xcf",
      "PageUp": "0xc9",
      "PageDown": "0xd1",
      "Delete": "0xd3",
      "Insert": "0xd2",
      "F1": "0x3b",
      "F2": "0x3c",
      "F3": "0x3d",
      "F4": "0x3e",
      "F5": "0x3f",
      "F6": "0x40",
      "F7": "0x41",
      "F8": "0x42",
      "F9": "0x43",
      "F10": "0x44",
      "F11": "0x57",
      "F12": "0x58",
      "Semicolon": "0x27",
      "Comma": "0x33",
      "Period": "0x34",
      "Slash": "0x35",
      "Backslash": "0x2b",
      "Quote": "0x28",
      "LeftBracket": "0x1a",
      "RightBracket": "0x1b",
      "Minus": "0x0c",
      "Equal": "0x0d",
      "Grave": "0x29"
    }
  },
  "virtualModifiers": {
  },
  "mappings": [
  ]
}
